{
  "horse_id": "622249",
  "horse": "example-value",
  "age": "example-value",
  "comment": "example-value",
  "colour": "example-value",
  "dam": "example-value",
  "dam_id": "285196",
  "draw": "example-value",
  "form": "example-value",
  "jockey": "example-value",
  "jockey_id": "491719",
  "jockey_claim": "example-value",
  "margin": "example-value",
  "number": "example-value",
  "odds": "example-value",
  "owner": "example-value",
  "position": "example-value",
  "prize": "example-value",
  "rating": "example-value",
  "scratched": "example-value",
  "sex": "example-value",
  "silk_url": "example-value",
  "sire": "example-value",
  "sire_id": "324932",
  "sp": "example-value",
  "stats": "example-value",
  "trainer": "example-value",
  "trainer_id": "957516",
  "weight": "example-value"
}